Code,Text
ARIN,Based on the fuzzy color histogram a kernel tracking method was proposed to reduce the illu mination sensitivity was widely used in tracking algorithms. The feature was constituted by calculating and counting histogram of gradient direction in a local region of image. The performance of these track ing algorithms was not shown to be excellent under intense illumination. 
ARIN,The tracking algorithms are evaluated on each segment of the sequence and the overall statistics are tallied. Using different initialization of the bounding box in the first frame to evaluate trackers is referred as SRE. The bounding box is initialized by shifting or scaling the ground truth in the first frame. The twelve kinds of spatial shifts are used to initialize the bounding box which are four kinds of center shifts four corner shifts and four kinds of scale changes. The performance of the tracking algorithms will be evaluated in different space initialization 
TECH,Fog com puting is built on the edge servers between sensor networks and cloud based data centers. It provides limited distributed computing storage and network services for users. Fog computing provides local intelligent analysis and feedback services for sensor networks. Fog computing can reduce the application delay the network bandwidth pressure and the calculation load of data center by providing data preprocess ing services for cloud computing 
ARIN,Our strategy is combined with the Discriminative Corre lation Filter DCF algorithms to improve their robustness under intense illumination conditions. Collaborative Corre lation Tracking CCT is one of the DCF methods. The DCF algorithm learns a correlation filter w from a series of training samples. It uses an .M N image patch x to train a classifier f .x hw xi by doing cyclic shift operations on it to produce training samples where M and N are the length and width of the patch. 
ARIN,During the detection process correlation filter based trackers detect the object by performing cyclic shift operations at the position of the previous frame which can generate a series of candidate windows. Then these candidate windows perform the correlation calculation with the filter which has been trained on the previous frame. After that the candidate win dow with the highest confidence is chosen as the target. The appearance model is an important part of tracking algorithms which mainly consists of two parts: visual representation and statistical modeling 
METH,Based on the speed of object the target which is obtained by performing multi positions' detection in the current frame is used to train another template context regression model Rc c. Because an intense lighting event can last for a period of time. In the next K frames the template Rc is used to detect the target and updated with the existing trained filter in each frame. Meanwhile the template Ra is in reserve and not be updated. After K frames we use alternate template Ra to detect object and update the template. 
TECH,In an IVS fog computing can utilize the technologies such as radio frequency identification RFID sensors wireless com munications satellite positioning etc. to collect and anno tate video information. With the help of fog computing framework the collected multi-target information can be ana lyzed on the service platform. 
TECH,The way to evaluate trackers is to run them throughout a test sequence with initialization from the ground truth position in the first frame. All the tracking methods are evaluated by three metrics. a. Distance precision DP. It illustrates the percentage of frames whose estimated location is within the given threshold distance of the ground truth. b. Overlap success rate OS. It is defined as the per centage of frames where bounding box overlap more than a threshold. c. Center location error CLE. It represents the mean Euclidean distance between the ground truth and the esti mated center position. 
TECH,The tracking algorithms are implemented on the near-site fog computing nodes. Every frame in the surveillance videos can be handled on the fog computing nodes. It is worth noting that the fog computing nodes not only offer computing power but also provide storage space. The original video data can be pre-processed and stored in fog computing nodes. Then it can be sent to the remote cloud center to do longer duration analysis for IVS. For example we can do a long-term analysis of traffic conditions in smart cities to solve urban congestion problems. 
ARIN,The Staple tracker did a simple combination of a Correlation Filter using HOG features and a global color histogram. The BIT tracker cascaded four units including appearance model S1 and C1 units and tracking model S2 and C2 units: S1 unit extracted texture and color information C1 unit collected texture and color features and combined them by using complex response maps S2 unit learned view-turned feature C2 unit used a full-connection neural network for task-dependent learning. 
ARIN,Another one is tracking by using CF methods and deep learning methods DCFNet SiamFC_3s and CFNet-con3. These trackers combine deep learning methods with correla tion filtering such as convolutional neural networks CNN. 
TECH,In order to track target smoothly under different com plex conditions this paper provided a novel strategy which performed multi positions' detection and used alternate tem plates MPAT for object tracking. Further a deployment framework was designed for IVS for intelligent surveillance systems based on fog computing 
TECH,The primary contribution of this work is the design of StreetVizor an interactive visual analytics system that helps planners leverage their domain knowledge in exploring human-scale urban forms based on street view images. Our system presents two-stage visual exploration: 1 an AOI Explorer for the visual comparison of spatial distributions and quantitative measurements in two areas-of-interest AOIs at city- and region-scales 2 and a Street Explorer with a novel parallel coordinate plot for the exploration of the fine-grained details of the urban forms at the street-scale. 
TECH,we introduce StreetVizor a visual analytics system for the exploration of human-scale urban forms based on GSV im ages. We develop the system in an iterative design process: specifi analysis requirements are described by a collaborating urban planner and the designs are evaluated and refined against requirements. To present information in concisely StreetVizor combines a set of well established visualization techniques including coordinated multiple views CMVs and scatterplot matrix with a new design of parallel coordinates that integrate street layout information. Our system utilizes advanced clustering models to enable the efficient exploration of street view patterns. 
METH,Street View Crawling. To reveal the surrounding scenes of a street space street views have to be crawled appropriately: succes sive images should reflect the continuous change in surrounding scenes. Hence the distance between two successive views should not exceed a limit that produces discontinuous scenes meanwhile it should not be too small which will cause computing overload. After experimenting with several options we find 50 meters is a suitable value for the distance between two successive views. 
METH,Street View Directions. Although GSV provides 360- degree panorama imagery only the front and back images in the directions of street headings at sampling locations are required. Side views are not utilized because of the following considera tions: First side views mainly present building facades and street sides and thus cannot correctly reflect other key features of street space e.g. road. Second side views are partially contained by the front and back images at nearby sampling locations. 
ARIN,StreetVizor is a web-based application comprising two major phases as illustrated in Fig. 2. In the data modeling phase our system auto matically collects hundreds of thousands of GSV images at sampling positions in each city generated from OpenStreetMap OSM Sec tion 5.1. Then we classify the pixels of the collected images into 12 classes using SegNet and extract the desired feature metric from the classification results Section 5.2. Data collection and preprocessing are conducted offline on a high-performance workstation with 12 core 3.40 GHz Intel Core i7-6800K CPU and a GeForce GTX 1080 graphics card. Though enabled with GPU acceleration the computation still takes several to 20 hours to preprocess images from each city. Then we construct data structures including an octree and a lookup table to facilitate visual exploration such as spatial query and filtering Sec tion 5.3. The datasets are stored in a back-end MongoDB server with 2.4 GHz Intel Xeon E5-2620 CPU and 64 GB memory. 
ARIN,Based on the configurations defined in Section 3.1 we develop an automatic approach to collect GSV images. We first download the area of a city from OSM and extract the road network from the OSM data. Next we apply a flood-fill algorithm that recursively goes through the entire road network every 50 meters starting from a randomly se lected location. After this operation is completed a list of sampling locations fposg with geographic information lat long is generated. We then pass each lat long into GSV API and extract the corresponding street information SI including street name s name and heading h. 
METH,We propose a DBN model for learning the criminals behavior. In every time-step of the DBN we capture the following actions: the defender assigns patrol officers to protect patrol areas and N criminals react to the defenders allocation strategy by committing crimes opportunistically. 
ARIN,After collecting street views we first classify the image pixels into 12 classes e.g. sky and building using SegNet which is a robust pixel-wise semantic labeling tool with a global accuracy of 82.8. Among the 12 classes we count the number of pixels for the identi fied five features i.e. greenery sky building road and vehicle and summarize the remaining pixels as others. We then normalize the feature data because pixel counts PC as raw output values are not intuitive. 
TECH,Ranking Explorer is developed to overview feature attributes across multiple AOI street candidates to help users quickly identify AOIs streets for comparison T.3.1. The explorer presents each can didate as a row and arranges its multivariate information in seven columns. The first column provides general information such as city and region street id. The remaining columns present the six features mean values as bars where mean values are normalized and encoded by bar lengths. 
ARIN,The clustering process groups geographically close street views with similar feature attributes together. Given that locations are integrated as two-dimensional spaces the algorithm forms more local clusters than an algorithm without considering spatial information which usually generates several big clusters with too many street views. The algo rithm may be further improved by adopting a network-based distance measurement approach other than Euclidean distance. We expect to form more representative clusters of street views with street network information. Nonetheless the current approach fulfills our requirement of reducing visual clutter. 
ARIN,We use standard deviation to indicate the measured feature diversity measured for each cluster and design diversity views that are arranged as six side-by-side small mul tiples for each feature as shown in Figure 5c. In every feature diversity view each cluster is represented as a dot with its x-value indicating the averaged feature value and y-value indicating stan dard deviation. In addition we use line segments to indicate the largest and smallest feature values in each cluster. In case an AOI may have hundreds of clusters that lead to serious visual clutter problem we implement a contour map view Fig. 5h to show overall distribution patterns. Users can interactively choose one of the views in accordance with different requirements 
TECH,Street Explorer is developed to enable the efficient comparison of human-scale urban forms at street-scale T.1.2. The explorer adapts the same layout as that in the AOI Explorer i.e. juxtaposition map views are placed on the top of the explorer whereas detailed statistics view are on the bottom. 
METH,The design goal for this view is to allow users to quantitatively compare human-scale urban forms from two streets. Although we can utilize the same views shown in the AOI Statistic View our collaborating domain expert SR is not satisfied. SR strongly recommended encoding street layout information in the view so that users can better leverage their knowledge about streets to perform in-depth analysis. SR felt the spatial information was not well integrated with the Street Map View. 
METH,The results of this study show that human-scale urban forms are correlated with regional functionalities. Meanwhile even though two regions may have the same functionalities street spaces in regions can be different between two cities. This may reflect the differences in city planning and development strategies between cities. 
ARIN,The analysis of human-scale urban form in this work relies heavily on a deep learning technique for image classification. Therefore classi fication accuracy poses serious challenges in our approach. We select SegNet which achieves a global accuracy of 82.8 out of the different classification techniques that we tried. The case studies show that the classification technique could provide reasonable analytical results on city- and region-scale human-scale urban form patterns. Nonetheless the results remain unsatisfactory in many cases especially when users would like to examine fine detailed urban forms at street-scale. 
METH,First we present a dynamic programming based algorithm that computes the optimal plan in our planning and updating process. While the dynamic programming approach is optimal it may be slow hence we also present a fast but sub-optimal greedy algorithm to solve the planning problem. 
METH,In fact we project a significant reduction in crime rate using our approach as opposed to the current patrolling approach see Figure 10. Given these results we expect our algorithm to be tested and eventually deployed in USC. More broadly by introducing a novel framework to reason about urban crimes along with efficient learning and planning algorithms we open the door to a new set of research challenges. 
METH,We propose a DBN model for learning the criminals behavior. In every time-step of the DBN we capture the following actions: the defender assigns patrol officers to protect patrol areas and N criminals react to the defenders allocation strategy by committing crimes opportunistically. 
TECH,Figure 11 to 13 presents the results from our experiments about the online learning and plan- ning mechanism. Four planning mechanisms that we consider are as follows: first a random planning mechanism that randomly generates allocation strat- egy with limited resources second a pure planning mechanism where we learn the criminal behavior model once and apply this model to plan for the entire horizon T using DOGS algo- rithm third a online planning mechanism with greedy planning al- gorithm that updates every Tu time-steps and the last mechanism is online planning mechanism with DOGS algorithm that also updates every Tu time-steps. In Figure 11 the total planning horizon T is set to 600. In addition to the four planning mechanisms we also consider the worst case where the defender always protect the least valuable targets. The x-axis shows the update interval Tu which is the time interval after which we update criminals behavior model. The y-axis is the expected number of crimes that happens under the deployed allocation strategy within 600 steps. Expected num- ber of crimes under pure planning mechanism stay the same with different Tu because it does not update the criminals model at all. For online mechanisms the expected number of crimes increases as the update interval Tu increases. This is because with infrequent updates of the criminals behavior model we cannot keep up with the real criminals behavior. In addition with any size of the up- date interval DOGS algorithm outperforms the greedy algorithm. In Figure 12 we present the runtime of three mechanisms for the same experiment. We do not show the runtime for the random plan- ning mechanism as it is small and same for any planning horizon T. The runtime decreases as the update interval Tu increases. There is a runtime-quality trade-off in choosing Tu. Figure 13 shows the performance of the four planning mechanisms but with different number of targets in the model. The x-axis is the number of targets in the graph and the y-axis is the expected number of crimes under the deployed strategy. We set T = 600 Tu = 2. The results here are similar to the results of Fig. 11. These results lead us to conclude that online mechanisms out- perform the baseline planning mechanisms significantly in any set- tings. For online mechanisms DOGS achieves better performance while greedy planning algorithm requires less runtime. Thus based on the specific problem being solved the appropriate algorithm must be chosen judiciously. 
METH,The presented predictive model is fitted by Random forest supervised machine learning algorithm in Weka benchmark. The attack type is set as the response variable and remaining considered as independents or predictors. 
ASSES,Every country of the world is focusing on developing a preventive mechanism to avoid terrorist attacks. Hence for prevention of terrorist attacks predictive modeling is trending by various researchers. 
METH,In the classification of terrorist attack region every classified played their 100 role except only Naïve Bayes NB who missed 269 instances and ANN missed only 1 instances during the classification process. The attack region attributes have 12 type of instances shown in table 2. 
METH,RF model fitting on the dataset with weapon type as the response variable and remaining are predictors. 
METH,In order to find a significant relation between six features the authors used rcorr function in the Hmisc package which yields significant correlation for Pearson and Spearman correlations methods. 
FEAS,The authors have analyzed the performance of attack predictive models in the previous section. It can be seen that predictive attack type model m1 used with RF achieved 84 accuracy to predict the response variable named attack type. The accuracy is same gained by both classifiers RT and J48. The SVM outperformed the ANN and NB in terms of accuracy. The lowest accuracy is achieved by ANN classifiers. 
FEAS,each classifier have achieved more than 75 accuracy which reveals the significance of every model. In case of attack region prediction every classifier provided 100 accuracy which stated predictive region model m2 is the best model to use in future. Therefore attack region can be easily predicts based on the selected predictors. The model m3 achieved 91 accuracy using RF and 90 using RT and J48 classifiers. 
METH,The architectural view on the flow of information for the METIS system follows an earlier research system concept: the Poseidon Demonstrator. Notably however a strong increase in the number of information sources and variability therein is the challenge in the METIS context. 
BPGO,To support the operators in the maritime domain cooperative systems for public safety strive to achieve following objectives: manage and support sea traffic including emergency situations protect the economic interests including the exploitation of resources at sea such as oil and gas enforce the law i.e. prevent crime and protect assets protect the environment among others from pollution and against illegal fishing control the border ranging from customs to smuggling and illegal immigration and defend the nation including explosive ordnance disposal. 
FEAS,The quality assessor determines the quality of both the information sources and the information on the blackboard. The quality of information sources is needed by the reconfigurator to determine the currently best query to be executed by the information retriever The quality of information on the blackboard is added as meta data to that information and include aspects such as trust accuracy and timeliness. 
FEAS, This project has as focus the integral handling and assessment of disparate and uncertain information sources in an efficient and expedient manner for such systems. This objective requires the bundling of various disciplines: Semantic web technologies information quality assessment and reasoning with uncertain information reconfiguration and replanning visualization and information architectures for systems in context are all needed to create the next generation system-of-systems for situation awareness support. The METIS project has brought together these disciplines in a single project supported by real-world domain knowledge of the industrial partner Thales. The integration of results and synergy between research partners is expected to create novel insights that will drive industrially applicable innovation. The current architecture as described in this paper enables research activities in situation awareness with systems of systems as is proven by the Poseidon project respectively. 
METH,Current situation awareness support systems typically automatically handle most sensor information and present the same information to all operators using a geographical representation of the current situation. The handling of information from other sources such as the Internet is left to the operators. 
METH,An informed rational decisionmaking strategy is needed to identify and respond to analytic health risk indications in biosurveillance data. One component of this strategy is to apply existing statistical process control methods to health-related data. This approach is not without difficulty and controversy because the health-related data and the underlying disease processes are generally more complicated and less controllable than manufacturing processes for which SPC was developed and to which it has been traditionally applied. However the standard SPC methods are being applied in actual syndromic surveillance systems and so here we illustrate their application and in particular how the performance of these methods is evaluated in the context of syndromic surveillance 
FEAS,The point here is that conducting a series of these types of simulations which explore a variety of out-of-control behaviors provides insight into the performance characteristics of the various methods. That is under the idealized simulation conditions it provides researchers and practitioners with information about whether and when each method should be preferred. This type of simulation comparison is commonly conducted in the industrial SPC literature. However they are not widely accepted in the public health world for a number of reasons including a lack of information about how to realistically simulate the in-control behavior of health data. 
PRED,While the multivariate CUSUM and simultaneous individual CUSUMs exhibited similar performance on the real hospital data in more abstract simulation evaluations such as in Figure 4 each seemed to demonstrate a separate specific strength: The modified MCUSUM is slightly better at detecting small shifts in many or all dimensions while the simultaneous individual CUSUMs seem better at detecting a shift in only one dimension. This suggests a strategy of using both in combination where in the public health arena for example individual hospitals might monitor their own trends using individual CUSUMs while a city county or state public health department might monitor an area using the MCUSUM. Or perhaps a public health department might use both the individual CUSUMs and the MCUSUM simultaneously but interpret their signals differently: An individual CUSUM signal indicates the possibility of a localized event while a MCUSUM signal indicates the possibility of a larger area-wide event. 
LACK,While at first glance the application of SPC methods to health-related data seems to be an immediate solution to the biosurveillance problem electronic biosurveillance is a less well-defined and more operationally complex problem than those for which SPC was originally developed hence there are many technical and other issues that need to be solved or resolved. One way to group the challenges is to consider three broad categories: definitional developmental and implementational. Important quantitative and statistical issues cut across all these areas but particularly the first two. 
TECH,Edge computing is a new distributed computing architecture that can break up complex computational workloads into small elements and perform them on local edge devices odes instead of offloading large volume data and workloads on a remote cloud data center. Here the edge devices odes can be any device with computing storage and network connectivity located at the frontiers of the Internet. For example they are not only the data producers such as the sensors surveillance cameras and smartphones but also the communication gateways e.g. switches routers access point and base station. 
