Code,Text
BPGO,Review your security measures and rehearse and review security and contingency plans. You should regularly review and exercise your plans to ensure that they remain accurate workable and up to date. You should be aware of the need to modify them to take into account any changes in your visitor attraction e.g. new building work changes to personnel information and communication systems and revised health and safety issues. Rehearsals and exercises should wherever possible be conducted in conjunction with all partners emergency services and local authorities. Make sure that your staff understand and accept the need for security measures and that security is seen as part of everyone's responsibility not merely something for security experts or professionals. Make it easy for people to raise concerns or report observations. 
BPGO,Creating your Security Plan The Security Manager should aim to produce a plan that has been fully exercised and which is regularly audited to ensure that it is still current and workable. Before you invest in additional security measures review what is already in place including known weaknesses such as blind spots in your CCTV system. When creating your security plan consider the following: details of all the protective security measures to be implemented covering physical information and personnel security instructions on how to respond to a threat e.g. telephone bomb threat instructions on how to respond to the discovery of a suspicious item or event a search plan evacuation plans and details on securing the attraction in the event of a full evacuation your business continuity plan a communications and media strategy which includes handling enquiries from concerned family and friends. Security Managers should also be familiar with the advice contained in the Fire Safety Risk Assessment – Large Places of Assembly guidance document. 
BPGO,Physical security is important in protecting against a range of threats and addressing vulnerability. Put in place security measures to remove or reduce your vulnerabilities to as low as reasonably practicable bearing in mind the need to consider safety as a priority at all times. Security measures must not compromise visitor safety. Your risk assessment will determine which measures you should adopt but they range from basic good housekeeping keeping communal areas clean and tidy through CCTV intruder alarms computer security and lighting to specialist solutions such as mail scanning equipment. 
BPGO,Keep access points to a minimum and make sure the boundary between public and private areas of your operation is secure and clearly signed. Invest in good quality access control Successful security measures require: the support of senior management staff awareness of the measures and their responsibility in making them work a senior identified person within your organisation having responsibility for security systems operated by magnetic swipe or contact proximity cards supported by PIN verification. 
BPGO,If a staff pass system is in place insist that staff wear their passes at all times and that their issuing is strictly controlled and regularly reviewed. Visitors to private areas should be escorted and should wear clearly marked temporary passes which must be returned on leaving. Anyone not displaying security passes in private areas should either be challenged or reported immediately to security or management 
BPGO,If you believe you might be at risk from a vehicle bomb the basic principle is to keep all vehicles at a safe distance. Those requiring essential access should be identified in advance and checked before being allowed through. If possible you should ensure that you have proper access control careful landscaping traffic-calming measures and robust well-lit barriers or bollards. Ideally keep non-essential vehicles at least 30 metres from your building. For site specific advice and guidance you should contact your local police CTSA. 
BPGO,Good quality doors and windows are essential to ensure building security. External doors should be strong well-lit and fitted with good quality locks. Doors that are not often used should be internally secured ensuring compliance with relevant fire safety regulations and their security monitored with an alarm system 
BPGO,ntrusion detection technology can play an importantrole in an integrated security system it is as much a deterrent as a means of protection. If police response to any alarm isrequired your system must be compliant with the Association of Chief Police Officers ACPOsecurity systemspolicy.seewww.securedbydesign.comandwww.acpo.police.ukForfurther information contactthe AlarmsAdministrationOffice at yourlocal police headquarters. Using CCTV can help clarify whether a security alert is real and is often vital in post-incident investigations but only if the images are good enough to identify what happened and be used in court. External lighting provides an obvious means of deterrence as well as detection but take into account the impact of additional lighting on your neighbours. If it is carefully designed and used external lighting will help security staff and improve the capabilities of CCTV systems 
BPGO,Good housekeeping improves the ambience of your visitor attraction and reduces the opportunity for placing suspicious items or bags and helps to deal with false alarms and hoaxes. You can reduce the number of places where devices may be left by considering the following points: avoid the use of litter bins around the attraction if possible but if you do this ensure that there is additional and prompt cleaning alternatively review the management of your litter bins and consider the size of their openings their blast mitigation capabilities and location i.e. do not place litter bins next to or near glazing or support structures. the use of clear bags for waste disposal is a further alternative as it provides an easier opportunity for staff to conduct an initial examination for suspicious items review the use and security of compactors wheelie bins and metal bins to store rubbish within service areas goods entrances and near areas where crowds congregate keep public and communal areas – exits entrances reception areas stairs halls lavatories washrooms – clean and tidy as well as service corridors and yards keep the furniture in such areas to a minimum – ensuring that there is little opportunity to hide devices including under chairs and sofas. temporary information stands concessionaires and kiosks should be searched before and after use and secured or moved when unattended lock unoccupied offices rooms and store cupboards ensure that everything has a place and that things are returned to that place place tamper proof plastic seals on maintenance hatches keep external areas as clean and tidy as possible all visitor attractions should have in place an agreed procedure for the management of contractors their vehicles and waste collection services. The vehicle registration mark VRM of each vehicle and its occupants should be known to the attraction security or management in advance pruning all vegetation and trees especially near entrances will assist in surveillance and prevent concealment of any packages. 
BPGO,Better blast resistance external barriers or a strengthened perimeter to prevent a penetrative ramming or close proximity parked or encroachment attack use of building materials which reduce the risk of fragmentation including blast resistant glazing and structural design which reduces the risk of building collapse and install doors and locks which are better able to withstand entry from armed intruders and provide robust ground floor facade material which together will help to provide cover for people caught up in a firearms attack. 
BPGO,Better building management facilities entrance arrangements which resist hostile entry the separation of general heating ventilation and air conditioning systems for entrance areas delivery areas and mailrooms from those occupying the main occupied spaces air intakes that are in a secure area and above first floor level hazardous material stores that are at a safe distance from the building and communications systems eg public address systems installed to pass on advice to those caught up in a firearms attack 
BPGO,Better traffic management and hostile vehicle mitigation measures structural measures that prevent access to or close proximity of unscreened vehicles to the building or space and measures that reduce the speed of vehicles approaching the site or its defences like bends or chicanes. 
BPGO,Better oversight clear lines of sight around a building absence of recesses on the façade or elevations of a building uncluttered street furniture well maintained and managed litter-free building surrounds that reduce the opportunity for suspicious hidden items and suspect activity to go unnoticed CCTV and security guarding to provide formal oversight orientating the building so that it overlooks public space and neighbouring buildings to support informal oversight by those who use and visit the location and well-managed access points and reception facilities that offer less opportunity for intruders to go undetected and may deter them from taking further action 
BPGO,Design a scalable security program that incorporates people technology and procedures to detect deter defend mitigate and respond to threats focusing on those high in likelihood of attack and with the greatest consequence. The scale of the program should be consistent with the size of the venue the expected attendance at each event and the amount of risk exposure. 
BPGO,Hire vet and train a security workforce with the knowledge skills and abilities to implement the security program and adapt to changes as needed in an ever changing threat environment. The workforce should have a clear division of work reasonable span of control and recognized chain of command. It should be able to transition smoothly from normal operations to an incident command structure for major incidents and interface seamlessly with management and other venue operations. 
BPGO,Manage communications among venue staff between staff and external responding agencies and between staff and patrons in a way that ensures the robust operability of communication systems and mitigates risk effectively during normal operations and emergencies. 
BPGO,Train staff constantly and repeatedly measure the effectiveness of the security program by collecting and evaluating data on the performance of all aspects of the program including that of security personnel supervisors and command elements. Some of the training should include tabletop and full scale exercises with external agencies responsible for incident response and recovery and the security program should include testing of the training and use of After Action Reports. These reports can be used to evaluate and improve performance not only after training but after routine minor incidents to establish the habit of review. 
BPGO,FY 2016 SAFECOM Guidance provides an overview of emergency communications systems and technical standards. Communication capabilities need to be provided in very challenging environments where critical infrastructures are often degraded or destroyed. Furthermore catastrophes natural disasters or other emergencies are usually unplanned events causing panic conditions in the civilian population and affecting existing resources. 
TECH,C4ISR systems use millions of sensors deployed on a range of platforms to provide advanced situational awareness. Radar video infrared or passive RF detection data are gathered by surveillance satellites airborne platforms UAVs Unmanned Aerial Vehicles ground stations and soldiers in the field. These data are delivered to an integration platform that analyzes them and delivers information up and down the chain of command. These platforms provide a Common Operational Picture COP allowing for enhanced coordination and control across the field. 
METH,Sensors monitoring human behavior may be used to assess the presence of people acting in a suspicious way. Leveraging information provided by pre-existing infrastructures might be critical. 
TECH,Body-worn sensors when deployed on a community scale offer information to support C4ISR. We have to distinguish between participatory and opportunistic sensing. The last one may be of particular relevance for under-cover personnel involved in reconnaissance missions in urban environments. Technologies for monitoring both workforce and their surroundings could aid when inferring physical or psychological states as well as assessing the risk of internal injury based on prior trauma. Soldiers can be alerted of abnormal states such as dehydration sleep deprivation elevated heart rate or low blood sugar and if necessary warn a medical response team in a base hospital. These wide range of health and security monitoring systems enables an effective end-to-end soldier health system including re-provisioning of health services when needed. 
TECH,In addition IoT can be used in some training and simulation exercises i.e. wearable receivers to mimic live combat. An example of live training may use cameras motion and acoustic sensors to track force during training exercises. The system would send data to trainers mobile devices who can coach in real time and produce edited video and statistics to review after the exercise. 
TECH,Other examples are Cubic s I-MILES Instrumented-multiple Integrated Laser Engagement System training solutions which simulate combat using lasers and visual augmentation. They use connectivity computer modeling and neuroscience-based learning tools to provide a more comprehensive real-time training experience. The solutions simulate artillery fire and provide a battle effect simulator which include explosive devices like land mines booby traps and pyrotechnics. 
TECH,IoT can ease ad-hoc mission-focused Intelligence Surveillance and Reconnaissance ISR via pairing sensors with mission assignments. Thus sensors and sensor platforms would not have to be burdened with excessive equipment to handle mission scenarios on their own. For example multiple devices entering an area of interest each with their own mission but relying on collaborative sensing to accommodate new or unanticipated requirements. In the case of a soldier its situational awareness increases allowing for improved survival and mission success. 
TECH,Crowdsensing promises to be an inexpensive tool for flexible real time monitoring of large areas and assessment for mission impact hence complementing services potentially available in smart cities. Researchers have devised services that allow for decoupling applications from the hardware. Secondly they are required to ensure a desired level of quality of the data collected. 
METH,Security cameras and sensors combined with sophisticated image analysis and pattern recognition software ease remote facility monitoring for security threats. In the case of marine and coastal surveillance using different kinds of sensors integrated in planes unmanned aerial vehicles satellites and ships make possible to control the maritime activities and traffic in large areas keep track of fishing boats and supervise environmental conditions and dangerous oil cargos. Other examples can be the monitoring of hazardous situations: combustion gases and preemptive fire conditions to define alert zones monitoring of soil moisture vibrations and earth density measurements to detect dangerous patterns in land conditions or earthquakes or distributed measurement of radiation levels in the surroundings of nuclear power stations to generate leakage alerts. 
TECH,Cameras have also been employed as external sensors for HAR. In fact the recognition of activities and gestures from video sequences has been the focus of extensive research developed by Microsoft. It allows the user to interact with the game by means of gestures without any controller device. 
BPGO,Crowd management is essentially a set of collaborative practices between a number of different actors e.g. event planners and managers emergency services local authorities transport authorities stewards and the crowd itself. These practices start months ahead of an event. In fact as we discuss in this paper preparations take about 90 of the efforts. Usually a multi-agency approach is followed incorporating all relevant parties to enable a wide range of knowledge and expertise to be drawn upon. Preparation activities include detailed risk analyses to identify and prioritize potential risks use and development of comprehensive what-if scenarios to consider management strategies and contingency plans establishment of a control point to coordinate all activities and personnel. The remaining 10 consists of implementing the plan comprising monitoring crowd activity to identify potential problems and intervention that in extreme conditions can result in crowd control. It must be noted that the focus of crowd management is facilitating crowd activities hence proactively preventing or quickly resolving problems. 
PRED,An approach to studying crowd behaviour is by synthesizing it through crowd behaviour prediction models. Crowd behaviour prediction models are also used for a-priori planning of events through simulation. 
PRED,A different approach is to investigate how to detect and recognize crowd behaviour. Traditionally computer-vision techniques have been employed to characterize and automatically detect anomalies in a crowd or recognize locations and places 
PRED,Crowd management is usually defined as the set of measures taken in the normal process of facilitating the movement and enjoyment of people for instance measures to control the distribution of people over a certain area. This definition fits that of the interviewees. From their responses crowd management is taken to refer mostly to the preparations for a given event and it involves predicting what is going to happen and preparing for it i.e. designing for the desired behaviour of the crowd. The preparations involve all aspects namely getting people into the site people participating to the event and getting people out of the site. These preparations usually start much ahead of the event e.g. six months or more. 
BPGO,GUARDS created a new game-theoretic framework that allows for heterogeneous defender activities and compact modeling of a large number of threats and developed an efficient solution technique based on general-purpose Stackelberg game solvers 
BPGO,Surveillance sensors such as ShotSpotter which can detect gunfire within 10 ft of a shot and determine the number of shooters to inform police response management. 
TECH,The combination of the IoT and more advanced data analytic capabilities and tools including artificial intelligence AI and machine learning 
TECH,to use sophisticated information technologies to interconnect and integrate information processes institutions and physical infrastructure to better serve citizens and communities Gil-Garcia 2012. 
BPGO,governments would have the ability to use sensors and HD cameras to collect information about air quality electric power consumption public safety road conditions and emergency preparedness among many other policy domains 
TECH, IoT uses analytics to predict and control the future and comprises of sensor actuators communications connectivity data analytics and security and smart applications that can be delivered to web and mobile interfaces 
LACK,In the complex IoT security domain IoT cybersecurity challenges have received a significant research attention including cybersecurity in manufacturing cyber-physical systems CPS Babiceanu Seker 2016 lack of comprehensive end-to-end standards fragmented cy bersecurity solutions in smart buildings Minoli Sohraby Occhiogrosso 2017 cybersecurity and privacy in smart homes Lin Bergmann 2016 cybersecurity in marketing Ng Wakenshaw 2017 and cybersecurity of complex cyber-physical networks Wen Yu Yu L 2017. 
BPGO,The FTC suggests that security should be built into device design which the GAO provided similar recommendations. Vendors should be capable of maintaining reasonable security and patches as well as offering upgrades to reduce vulnerabilities Latta Welch 2016. 
BPOP,energy many other federal agencies are adopting the use of IoT in defense to support their missions. For example the DoD is using the IoT more efficiently to manage how it tracks military goods such as clothing construction materials and medical supplies Castro et al. 2016. 
TECH,This DSS called the Predictive Police Patrolling DSS P3-DSS has been developed in collaborationwith the Spanish Nation al Police Corps SNPC. 
ARIN,This DSS provides predictive policing capabilities for forecasting the distribution of crime risk in a territory as well as an optimization system that exploits this information to distribute agents in the best possible way according to the preferences of the decision maker 
ARIN,In this model the police deployment adapts dynamically to changing crime patterns making criminals modify to a certain degree their awareness and their criminal actions 
METH,During the process of knowledge discovery we use the FSOM neural network to uncover crime patterns from data of the crime volume in Taiwan provided by the NPA 
TECH,presents an urban infrastructure safety monitoring system known as Urban Safety which makes urban infrastructure damage information collection possible for public participants and allows monitoring and emergency evaluation in the field of disaster prevention and mitigation 
BPGO,This paper presents results of capturing and exploring data on pedestrian movement with CV tracking technology from a pilot study we conducted in the summer of 2013 in the urban plaza Kultorvet in central Copenhagen. 
TECH,Computer Vision algorithms can be applied on video from both normal RGB cameras and thermal cameras. In terms of performance of CV algorithms there are advantages and disadvantages in both technologies that need to be considered. 
ARIN,In this research a combination of spatial clustering methods and artificial neural network models was used in order to predict the high crime risk transportation areas 
ARIN,Geographic information systems were used to perform spatial analysis so as to identify the regions with a high concentration of crime incidents. Artificial intelligence was used in this study in order to build artificial neural network predictive models. 
ARIN,to propose a new framework by defining the useful patterns of suicide attacks to analyze the terrorist activity patterns and relations to understand behaviors and their future moves and finally to prevent potential terrorist attacks. 
ARIN,It is an early attempt to identify meaningful patterns in suicide attacks using network models. More specifically a new Evolution Stimulating Annealing Lasso least absolute shrinkage and selection operator Logistic Regression ESALLOR is proposed to define the best features for similarity function and to find the important key features e.g. how important the features are shown for successful and interactive terrorist events. 
TECH,Automated video surveillance systems constitute a network of video sensors observing people as well as other moving and interacting objects in a given environment for patterns of normal abnormal activities interesting events and other domainspecific goals. 
ARIN,Given a set of training examples each marked as belonging to one of two categories an SVM training algorithm builds a model that assigns new examples into one category or the other. An 
ARIN,We proposed the application of a combined Neocognitron type of neural network classifier in generic car license plate recognition CLPR system. The suggested system contains an image-processor a segment-processor and five combined Neocognitron network classifiers which act as a character recognizer. 
ARIN,We have proposed transductive clustering and analyzed the relationship between bag-snatching and spatial attributes in the Fushimi-ku area of Kyoto City. 
ASSES,we design an approach that is able to account for the variations in firearm generated recoil as recorded by a wrist worn accelerometer and helps categorize the impulse forces. 
TECH,Examining how these sensors can be used to extend HAR with mobile devices for detecting gunshots is the focus of this study. 
BPOP,The ShotMaxx timer developed by Double AlphaAcademy also works with their mobile application and provides mobile data fusion with sound and accelerometers for gunshot detection 
TECH,We propose algorithms that are able to alert the human operator when a firearm or knife is visible in the image 
ASSES,Thus the particle image velocimetry PIV method based on the cross-correlation algorithm is used to analyze the dynamic of crowd in the ticket hall. Actually the PIV algorithm is non-intrusive and does not require high resolution and contrast video which also contributes to the application of this method 
ASSES,drone empowered small cellular networks DSCNs are key enablers towards the deployment of resilient communication networks for smart cities 
TECH,an autonomous method is proposed to detect abnormal human behavior this method is applicable to smart surveillance monitor systems. 
TECH,by presenting an integrated term-relationship mining method and proposing evidence-based exploration for term network applied to crime investigation. 
TECH,We developed a 3D CNN model for action recognition in this paper. This model construct features from both spatial and temporal dimensions by performing 3D convolutions. 
