Code,Text
ASSES,Modeling of interactions in outdoor scenarios: All the above quoted studies face the problem of the interaction modelling in very constrained scenarios meetings games etc. where interacting activities are foreseen or expected. In outdoor scenarios the simple spatial proximity is usually assumed as warrantee for interaction: this is intuitively false in crowded situations like cocktail parties. Therefore a more precise definition of interaction has to be provided. 
PRED,Social Signal Processing aims at developing theories and algorithms that codify how human beings behave while involved in social interactions putting together perspectives from sociol- ogy psychology and computer science 
ASSES,The problem is that measuring the VFOA by using eye gaze is often difficult or impossible in standard surveillance scenarios: either the movement of the subject has to be constrained or high-resolution images of the eyes are required. Therefore the viewing direction has been reasonably approximated by just measuring the head pose 
ASSES,Since the specific setup is very constrained this model works pretty well. However as observed by the authors more general setups impose more complex models that consider camera position people location and scene structure. 
PRED,Active Appearance Model models the face and pose of a person in order to discover which portion of a mall-shelf is observed. Following this claim and considering a general unrestricted scenario where people can enter leave and move freely the VFOA can be approximated by the three-dimensional 3D visual field of an individual. More precisely according to biological evidence the VFOA can be described as a 3D polyhedron delimiting the portion of the scene that the subject is looking at 
METH,Most recently in an approach for the joint tracking in surveillance videos of pose behavioral cues body position pose and head pose is presented. Given the tracks generated by a multi-person tracker they first localize the head and extract body and head pose features. Then these features are used to jointly estimate the pose cues in a 3D space using a particle filtering approach that exploits the conditional coupling between body position movement direction and body pose together with the soft coupling between body pose and head pose. 
METH,prosody that can provide social signals like competence linguistic vocalization that can communicate hesitation nonlinguistic vocalization that can provide strong emotional states or tight social bonds silence that can express hesitation and turn taking patterns: this last compo- nent is the most investigated in this category since it appears the most reliable when the goal is to recognize people personality or modeling the type of inter- actions e.g. a conflict. 
PRED,More recently a generative framework has been proposed aimed at classifying conversation intervals of variable length from a few minutes to hours considering the nature of the people involved within children adults and the main mood. 
FEAS,In surveillance approaches that face monitoring scenarios con- sidering vocal behavior cues are absent since the audio modality is hard to be captured in wide areas and most importantly it is usually forbidden for privacy issues. The problem lies in the fact that audio processing is usually associated with speech recognition while in the case of SSP the content of a conversation is ignored. 
PRED,An approach that could be instantiated in a surveillance context is that of the consequence of a competition for holding the floor and preventing others from speaking. 
PRED,The keystone model for the interaction modeling of moving people i.e. a basic form of behavior is given in the social force model SFM that applies a gas-kinetic analogy to the dynamics of pedestrians. It is not an interaction detection system rather it is a physical model for simulating pedestrian interactions while they are moving. Pedestrians are assumed to react to energy potentials caused by other pedestrians and static obstacles through a repulsive or an attractive force while trying to keep a desired speed and motion direction. This model can be thought as explaining group formations and obstacle avoidance strategies i.e. basic and generic form of human interactions. 
PRED,The social force model has been modified in to train a dynamic model for predicting the position of moving subjects employing the SFM. Even in this case the attraction factor of the SFM is ignored. 
PRED,In F-formations are found in a cocktail party scenario by employing proxemics elements and head orientation estimates. The approach is based on a Hough voting strategy and represents an accurate modeling of the formal definition of F-formation. The main characteristics are that people have to be reasonably close to each other have to be oriented toward the O-space and that the O-space has to be empty to allow the individuals to look at each other. 
PRED,They define an F-formation as a set of focused encounters and this distinction serves to discriminate a group where people is willing to stay to those group formations resulting from environmental constraints people that move in a narrow road. The authors use a graph clustering algorithm by formulating the problem in terms of identifying dominant sets. A dominant set is a form of maximal clique which occurs in edge weighted graphs. As well as using the proximity between people body orientation information is used. 
PRED,Analyzing a crowd represents without doubts a new dimen- sion for the automated surveillance. The idea is to monitor huge masses of people categorizing how they move and looking for normal and abnormal situations due for example to incidents panic attacks etc. This mission is intriguing because it requires to revise the whole surveillance flowchart previously described 
FEAS,Actually each single individual here cannot be characterized as finely as in the case of 5–10 people: occlusions are very strong and the classical object classification and tracking approaches have shown to be scarcely effective 
PRED,In an individual target tracking strategy for unstructured crowded scenes is presented. Here the crowd is modeled using Correlation Topic Model CTM: the idea is that the dynamics of the crowd is learned by quantized local features correlated together with the use of topic models. Given the observed measurements of the object to be tracked the next position is obtained by incorpor- ating in the object state hypothesis the learned high-level scene dynamics. 
PRED,A new scheme to detect the motion patterns in the crowded scenarios is presented in. This scheme utilizes the instanta- neous motion flow estimating the optical flow field. The typical motion patterns are then detected by clustering the flow vectors from the motion flow. 
FEAS,At the best of our knowledge current methods are still far from coupling surveillance and Social Signal Processing in the field of crowd analysis. 
TECH,security in the smart cities context involves now the management of public spaces with the use of the internet to access to geo-information overlaid with processed data and information for decision-support. From this technology perspective alone a key driver which will aid smart cities to be managed at localised levels involves the deployment and use of large scale sensor networks for monitoring and recording crime incidents and beyond 
TECH,With the pervasive nature of smart mobile devices and their capability to be adopted as sensor platforms. In particular the generated big sensor data from mobile devices shall become the prime Citizens observatories for aiding local authorities achieve detailed and real-time measurement of crimes at catchment levels in cities. 
TECH,The DSSP is a web enabled information system environment which gives access to integrated data and information for the management of hazards and potential crimes incidents in cities. It allows users perform scenarios for the design of safer spaces. The DSSP is split into two main parts the server side and the user or client side. Fig. 1 illustrates a high level view of the overall system. The server-side is com prised of 3 distinct layers. The top layer concerns the various data sources. The mid dle layer is the analytics layer which incorporates local cache for data processing. Finally the lower layer specialises in data visualisation 
TECH,Urban spaces in DSSP are defined as boundaries in the form of geospatial data polygons. These polygons are used as our base boundary layer which allow us to filter and group the crime incidents and on top of which we do all the visualisations and analysis. Although a city can be defined in geographical terms by a single but complex polygon smaller divisions of a city such as boroughs districts neighbourhoods should also be defined in similar terms i.e. geospatial data polygons 
ARIN,The DSSP converts crime incidents coordinates into longitude and latitude within the WGS84 datum. Finally crime data are filtered and stored. We use a modified ray cast ing algorihtm to decide if a crime lies within a specific polygon at a particular zoom level. 
METH,Postcodes are not associated with the other geographical entities because their boundaries are not matching. Currently we only use the postcode information for visualisation so this is not a problem. 
TECH,The DSSP provides all the necessary tools to analyse and harvest information from the different data sources. Processed data is stored in a local database. Analysis of data can take the form of normalisation processing and conversion between coordi nate systems. Upon data ingest the data is filtered and aligned to the boundary polygons for use in creation of the crime data reports 
TECH,The DSSP provides a rich set of data visualisations including interactive maps with different levels of information for different resolution levels. Also area statistics with pie and line charts and comparisons and correlations between two different areas of interest. Finally it also provides heatmaps for each crime type and crime point projec tions. The DSSP mapping service is comprised of the following parts the base map data the javascript interaction library and the map server. 
ARIN,The DSSP currently has the base OpenStreetMap layer and 11 additional layers for different types of heat-maps. The charts are created with jqPlot which is a javascript based plotting library. It plots data transmitted from the server via JSON objects. The basis for the user interface is Twit ter Bootstrap. 
TECH,DInR is a simple mobile app which is under development at the moment in order to facilitate individuals submitting re ports into the DSSP directly using their mobile phones. Currently DInR is running on Android 4.1 phones or tablets and provides most of required report fields. DInR can successfully create and submit reports to the current version of DSSP system. DInR can provide automatically 3 5 data fields in the user report consequently smartphone users can submit to DSSP user data with a minimal effort 
FEAS,The current implementation of the system prototype runs on two distinct machines. The first machine hosts the main application while the second on the Tileserver. This separation of machine allows for independent optimisation and deployment of the two main components. The main application runs on a machine with an 2.83 GHz CPU and 4GB of RAM. The Tileserver has an 2.83 GHz CPU 4GB of RAM and 2 TB of fast storage. 
TECH,In recent years our research team has introduced the use of a range of aerial platforms and an innovative application of thermography to detect several illegal activities for example illegal sanitary sewer and storm-drain connec tions illicit wastewater discharges and other anoma lies on surface waters can be easily identified using their thermal infrared signatures It can also be used to detect illegal solid liquid waste dumps or illicit air dis charges. 
TECH,One of the techniques they are using is infrared IR imaging of suspected sites with equipment mounted on helicopters or small drones. This novel technique de veloped by researchers at the Parthenope University of Naples is being coupled with an innovative data management system also developed at Parthenope to detect potential illicit discharges and track them to their source. 
TECH,In this paper we demonstrate the added value of the use of an integrated approach that combines aerial platforms e.g. drones advanced sensors e.g. IR cameras and specific IT tools Gargiulo et al. 2013 Persechino et al. 2010 Persechino et al. 2013 e.g. multi-view 3 days reconstructions and edge detection in the environmental police investiga tions. 
TECH,An IR thermal sensor detects radiant energy from a surface target heated through radiation convection and conduction. These instruments Lega and Napoli 2010 can accurately detect the difference in temperature be tween two or more objects in the same IR thermal image but they are not able to measure the absolute object temperature. 
METH,it is possible to create a multilayer struc ture Fig. 6 that permits one to represent in one shot and in overlay all the data acquired during the mission. This approach simplifies the interpretation of data and allows the investigator to filter the anomalies related to the specific morphology of the land. 
TECH,The complex and repetitive classification tasks the necessity of increasing the reliability and objectivity of decisions judgments or diagnoses and the research works about the human brain promoted the development of algo rithms also called machines capable of extracting essential knowledge from the environment and representing it mathematically in order to learn from such a representation a concept of class or category and to identify objects or classify them automatically. Pattern recognition is an example of advanced object recognition which is influenced by several factors such as shape reflectance pose occlusion and illumination which make it a difficult task 
ARIN,Edge detection refers to the process of identifying and locating sharp discontinuities in an image. The disconti nuities are abrupt changes in pixel intensity that charac terize boundaries of objects in a scene. 
TECH,Combining edge detection and pattern recognition tracking ideas our new concept is termed Thermal Tracking. Using thermal tracking pictures matrixes that are the rendering of an IR dataset grabbed with an IR camera with radiometric output can be analyzed links between two or more objects in the same scene can be found and a source path target correlation can be defined. 
ARIN,the Canny algorithm appears to detect the largest amount of surface structures while the Sobel and Prewitt detectors seemed to be very sensitive to noise in the image. Moreover the Canny method pro duces the largest ratio of edge pixels-to-total pixels and finds more edges than the others algorithms. 
BPGO,The proposed procedures techniques and technologies were tested and validated during environmental police actions directed by Italian Government Bodies e.g. the Public Prosecutor Environmental Protection Agency Coast Guard Financial Police Italian State Forestry Corps etc. in real field operations as well as in demon stration activities 
BPGO,In recent years our research team has introduced the use of a range of aerial platforms and an innovative application of thermography to detect several illegal activities for example illegal sanitary sewer and storm-drain connections illicit wastewater discharges and other anomalies on surface waters can be easily identified using their thermal infrared signatures. 
ARIN,The data mining techniques used in the present research work are clustering classification and deviation detection. Clustering techniques group data items into classes with similar characteristics to maximize or minimize intraclass similarity. For example to identify suspects who conduct crimes in similar ways or distinguish among groups belonging to different gangs. These techniques do not have a set of predefined classes for assigning items. Some researchers use the statistics-based concept space algorithm to automatically associate different objects such as persons organizations and vehicles in crime records. 
TECH,Deviation detection uses specific measures to study data that differs markedly from the rest of the data. Also called outlier detection investigators can apply this technique to fraud detection network intrusion detection and other crime analyses. However such activities can sometimes appear to be normal making it difficult to identify outliers. 
ARIN,the traditional KNN Imputation method was enhanced in two manners. The first enhancement is achieved by proposing a new distance metric and the second enhancement is achieved by using LVQ Learning Vector Quantization methods combined with generalized relevance learning to perform the classification and missing value treatment simultaneously. Both these enhancement when combined together produces a model E-KDD that is efficient in terms of speed and accuracy. 
ARIN,clustering is the process of class discovery where the objects are grouped into clusters and the classes are unknown beforehand. Two clustering techniques K-means and DBScan Density-Based Spatial Clustering Application with Noise algorithm are considered for this purpose. The algorithm for k-means is given below 
ARIN,The basic approach to detect outliers is to find large non-globular clusters and define all the very small clusters outside of them as outliers. PAM Partitioning Around Medoid algorithm is used for this purpose. The PAM algorithm has the drawback of high computation complexity which has a direct impact on the speed of anomaly detection. This complexity raised due to the huge number of computations required during anomaly detection. 
ARIN,This paper focused on improving missing value handling procedures for efficient clustering and classification and to predict the future crime. A major challenge facing all law-enforcement and intelligence-gathering organizations is accurately and efficiently analyzing the growing volumes of crime data. As information science and technology progress sophisticated data mining and artificial intelligence tools are increasingly accessible to the law enforcement community. These techniques combined with state-of-the-art Computers can process thousands of instructions in seconds saving precious time. In addition installing and running software often costs less than hiring and training personnel. Computers are also less prone to errors than human investigators especially those who work long hours. 
ARIN,we study the application of fuzzy association rule mining for community crime pattern discovery. Discovered rules are presented and discussed at regional and national levels. Rules found to hold in all states be consistent across all regions and subsets of regions are also discussed. A relative support metric was defined to extract rare novel rules from thousands of discovered rules. Such an approach relieves the need of law enforcement personnel to sift through uninteresting obvious rules in order to find interesting and meaningful crime patterns of importance to their community. 
ARIN,Following are several current trends in crime analysis: Geospatial map-based visualization. Geographical clustering of crime activity such as identifying hot spots. Serial criminal behavioral pattern profiling and criminal career analysis. Gang criminal network analysis. Data stream anomaly novelty or outlier detection. Temporal analysis of crime patterns such as crime sprees temporal association of crime from an individual or group. Linking threats to risk of critical infrastructure based on vulnerability assessments. 
TECH,Knowledge discovery is one accepted tool for identifying underlying novel patterns in large volumes of crime data. For example association rule mining has become a prominent method for performing knowledge discovery on large transactional databases. 
ARIN,Research efforts for mining crime patterns have recently increased focusing on a variety of approaches. For example knowledge discovery was performed by mining association rules training a classifier for prediction and utilizing clustering methods in takes a geospatial approach at discovering crime patterns by clustering and displaying regional crime on a map. The k-means clustering algorithm was coupled with an attribute importance- weighting algorithm to cluster crimes by type. 
ARIN,A limitation of association rule mining is that it only works on binary transaction data i.e. an item was either purchased in a transaction 1 or not 0. In many real-world applications data is either categorical e.g. blue red green or quantitative e.g. number of murders. For numerical and categorical attributes Boolean rules are unsatisfactory. Extensions have been proposed to operate on these data such as quantitative association rule mining. 
ARIN,Rare association rule mining is a newer and less well understood discipline than frequent association rule mining. One of the approaches to rare association rule mining is to use the same algorithms as for frequent item mining such as Apriori while selecting a low minimum support. Setting minsup very low causes a combinatorial explosion in the number of generated itemsets and rules. This necessitates the use of rule post-pruning methods which facilitates extraction of interesting rules from a large set. 
METH,Rules are additionally pruned based on their support confidence and lift. Confidence- and lift-based pruning methods are the same for frequent and rare rule mining. Support-based pruning must be different since in frequent rule mining it is usually trivial to find the minimum support that is adequate for the entire data set. In contrast rare rule mining requires setting the minsup to low causing a combinatorial explosion of the number of rules. 
METH,Five variables were redefined by computing their values per 100k population: People in Homeless Shelters Homeless People Counted in Street Murders Robberies and Assaults. The transformed data was used in the study. In the remainder of this paper when referring to the variables computed per 100k population we will use their proper names. For example we will refer to Violent Crimes instead of Violent Crime Per 100K Population. 
METH,Rule post-pruning is concerned with pruning rules after they have been generated by an algorithm such as Fuzzy Apriori. We are post-pruning rules based on 60 fuzzy confidence. 
METH,As the number of communities within each region differs minimum supports were calculated for each region based on the support of a rule occurring the same number of times within that region. This unifies support across regions for reliable comparison of rule measures and facilitates discovery of consistent rules across all or subsets of the five US regions. 
ARIN,All data was used in this experiment which included 2215 communities located throughout the US. Fuzzy Apriori was run with confidence 60 and support 0.135. A total of 13657 rules were generated. Post-pruning using a Relative Fuzzy Support of 1.0 reduced this number to a much more manageable number of 657 rules of interest. This represents a 95.2 reduction in the number of rules. 
METH,Rules generated from each region's data set were analyzed to measure consistency of discovered frequent patterns across all regions and region subsets. Rules represented by multiple regions are considered more general with generality increasing with the number of matched regions. Therefore a consistent rule can range from occurring across only two regions to occurring across all regions. Additionally rules unique to each region were identified to provide more fine-grained regional trends. 
ARIN,Fuzzy association rule mining has proven useful for this crime application and has utility for other crime-related data sets. To the knowledge of the authors this is the first experimental study of applying fuzzy association rule mining to a crime data set. Results presented in this paper suggest that further analysis is required to gain a closer understanding of crime at both the community and national levels. 
ASSES,In this approach the need for modeling of counter-terrorism information defines certain tasks whose multiplicity is determined by lack of integrity and fragmented knowledge available through the relevant research on the subject. A single set of tasks aimed at solving this problem includes: – development of theoretical and methodological fundamentals of information counteraction to terrorism and extremism – substantiation of the benefits of the modeling method when studying terrorism and extremism as a social phenomenon – articulation of the factors and conditions of occurring terrorism and extremism in the social and informational environment to formalize the parameters of the information counteraction model – analysis of methods of information counteraction to terrorism and extremism – study of the structure and content of the information counteraction occurring in terrorist and extremist activities in the social environment – development of models of informational influence control and counteraction in the social environment – study of models in order to create optimal control social and information influences to reduce the existing threats of terrorism and extremism. Solution of these tasks will allow for future development of science-based management decisions on information counteraction to terrorism and extremism through the preservation of the qualitative characteristics of information and cultural environment of the society as well as for development of ideas for improving counter-terrorist and counter- extremist policy based on the research conducted. 
